<?xml version="1.0" encoding="UTF-8"?>
<eLibrary xmlns:xsi="http://www.w3.org/2001/XMLSchema-instance"
          xsi:noNamespaceSchemaLocation="elibrary.xsd">
    
    <!-- Primary Education (Enseignement Primaire) -->
    <educationLevel id="L001" code="PRIMARY">
        <n>Enseignement Primaire</n>
        <duration>6 years</duration>
        <grades>
            <grade number="1">1ère année primaire</grade>
            <grade number="2">2ème année primaire</grade>
            <grade number="3">3ème année primaire</grade>
            <grade number="4">4ème année primaire</grade>
            <grade number="5">5ème année primaire</grade>
            <grade number="6">6ème année primaire</grade>
        </grades>
        <books>
            <book id="B001" grade="1">
                <title>القراءة العربية للسنة الأولى</title>
                <subject>Arabic Language</subject>
                <author>وزارة التربية التونسية</author>
                <isbn>978-9973-123-45-6</isbn>
                <publicationYear>2023</publicationYear>
                <format>PDF</format>
                <language>Arabic</language>
            </book>
            <book id="B002" grade="1">
                <title>Mathématiques 1ère année</title>
                <subject>Mathematics</subject>
                <author>Ministère de l'Éducation</author>
                <isbn>978-9973-123-46-3</isbn>
                <publicationYear>2023</publicationYear>
                <format>PDF</format>
                <language>French</language>
            </book>
            <book id="B003" grade="6">
                <title>Sciences Naturelles 6ème année</title>
                <subject>Natural Sciences</subject>
                <author>Ahmed Ben Salem</author>
                <isbn>978-9973-123-47-0</isbn>
                <publicationYear>2022</publicationYear>
                <format>EPUB</format>
                <language>French</language>
            </book>
        </books>
    </educationLevel>

    <!-- Secondary Education - Preparatory (Collège) -->
    <educationLevel id="L002" code="PREPARATORY">
        <n>Enseignement Préparatoire</n>
        <duration>3 years</duration>
        <grades>
            <grade number="7">7ème année de base</grade>
            <grade number="8">8ème année de base</grade>
            <grade number="9">9ème année de base</grade>
        </grades>
        <books>
            <book id="B004" grade="9">
                <title>Physique-Chimie 9ème année</title>
                <subject>Physics and Chemistry</subject>
                <author>Mohamed Trabelsi</author>
                <isbn>978-9973-124-01-2</isbn>
                <publicationYear>2023</publicationYear>
                <format>PDF</format>
                <language>French</language>
            </book>
            <book id="B005" grade="8">
                <title>التاريخ والجغرافيا للسنة الثامنة</title>
                <subject>History and Geography</subject>
                <author>فاطمة بن عمر</author>
                <isbn>978-9973-124-02-9</isbn>
                <publicationYear>2022</publicationYear>
                <format>PDF</format>
                <language>Arabic</language>
            </book>
        </books>
    </educationLevel>

    <!-- Secondary Education (Lycée) -->
    <educationLevel id="L003" code="SECONDARY">
        <n>Enseignement Secondaire</n>
        <duration>4 years</duration>
        <grades>
            <grade number="10">1ère année secondaire</grade>
            <grade number="11">2ème année secondaire</grade>
            <grade number="12">3ème année secondaire</grade>
            <grade number="13">4ème année secondaire (Baccalauréat)</grade>
        </grades>
        <specializations>
            <specialization code="SCI">Sciences Expérimentales</specialization>
            <specialization code="MATH">Mathématiques</specialization>
            <specialization code="TECH">Sciences Techniques</specialization>
            <specialization code="ECO">Économie et Gestion</specialization>
            <specialization code="LETT">Lettres</specialization>
            <specialization code="INFO">Sciences de l'Informatique</specialization>
        </specializations>
        <books>
            <book id="B006" grade="13" specialization="MATH">
                <title>Analyse Mathématique - Bac Mathématiques</title>
                <subject>Advanced Mathematics</subject>
                <author>Hedi Lakhal</author>
                <isbn>978-9973-125-01-8</isbn>
                <publicationYear>2023</publicationYear>
                <format>PDF</format>
                <language>French</language>
            </book>
            <book id="B007" grade="13" specialization="SCI">
                <title>Biologie - Sciences Expérimentales</title>
                <subject>Biology</subject>
                <author>Salma Gharbi</author>
                <isbn>978-9973-125-02-5</isbn>
                <publicationYear>2023</publicationYear>
                <format>EPUB</format>
                <language>French</language>
            </book>
            <book id="B008" grade="12" specialization="INFO">
                <title>Programmation et Algorithmique</title>
                <subject>Computer Science</subject>
                <author>Karim Jebali</author>
                <isbn>978-9973-125-03-2</isbn>
                <publicationYear>2022</publicationYear>
                <format>PDF</format>
                <language>French</language>
            </book>
            <book id="B020" grade="10">
                <title>Introduction aux Sciences</title>
                <subject>General Sciences</subject>
                <author>Nadia Mansour</author>
                <isbn>978-9973-125-10-0</isbn>
                <publicationYear>2023</publicationYear>
                <format>PDF</format>
                <language>French</language>
            </book>
            <book id="B021" grade="11" specialization="MATH">
                <title>Algèbre et Géométrie</title>
                <subject>Mathematics</subject>
                <author>Kamel Toumi</author>
                <isbn>978-9973-125-11-7</isbn>
                <publicationYear>2023</publicationYear>
                <format>PDF</format>
                <language>French</language>
            </book>
        </books>
    </educationLevel>

    <!-- Preparatory Engineering School (Classes Préparatoires) -->
    <educationLevel id="L004" code="PREP_ENG">
        <n>Classes Préparatoires aux Études d'Ingénieurs</n>
        <duration>2 years</duration>
        <grades>
            <grade number="1">1ère année prépa</grade>
            <grade number="2">2ème année prépa</grade>
        </grades>
        <specializations>
            <specialization code="MP">Mathématiques et Physique (MP)</specialization>
            <specialization code="PC">Physique et Chimie (PC)</specialization>
            <specialization code="BG">Biologie et Géologie (BG)</specialization>
            <specialization code="PT">Physique et Technologie (PT)</specialization>
        </specializations>
        <books>
            <book id="B022" grade="1" specialization="MP">
                <title>Mathématiques Supérieures - MP</title>
                <subject>Advanced Mathematics</subject>
                <author>Ali Jendoubi</author>
                <isbn>978-9973-129-01-2</isbn>
                <publicationYear>2023</publicationYear>
                <format>PDF</format>
                <language>French</language>
            </book>
            <book id="B023" grade="1" specialization="PC">
                <title>Physique Générale - PC</title>
                <subject>General Physics</subject>
                <author>Sami Bouaziz</author>
                <isbn>978-9973-129-02-9</isbn>
                <publicationYear>2023</publicationYear>
                <format>PDF</format>
                <language>French</language>
            </book>
            <book id="B024" grade="2" specialization="MP">
                <title>Analyse et Algèbre - Spé MP</title>
                <subject>Advanced Mathematics</subject>
                <author>Nejla Hammami</author>
                <isbn>978-9973-129-03-6</isbn>
                <publicationYear>2023</publicationYear>
                <format>PDF</format>
                <language>French</language>
            </book>
            <book id="B025" grade="1" specialization="BG">
                <title>Biologie Cellulaire et Moléculaire</title>
                <subject>Cell Biology</subject>
                <author>Mounir Zarrouk</author>
                <isbn>978-9973-129-04-3</isbn>
                <publicationYear>2022</publicationYear>
                <format>PDF</format>
                <language>French</language>
            </book>
            <book id="B026" grade="2" specialization="PT">
                <title>Sciences Industrielles de l'Ingénieur</title>
                <subject>Industrial Engineering</subject>
                <author>Hafedh Abdelkafi</author>
                <isbn>978-9973-129-05-0</isbn>
                <publicationYear>2023</publicationYear>
                <format>PDF</format>
                <language>French</language>
            </book>
        </books>
    </educationLevel>

    <!-- Engineering School (École d'Ingénieurs) -->
    <educationLevel id="L005" code="ENGINEERING">
        <n>École d'Ingénieurs</n>
        <duration>3 years</duration>
        <grades>
            <grade number="1">1ère année ingénieur</grade>
            <grade number="2">2ème année ingénieur</grade>
            <grade number="3">3ème année ingénieur (Diplôme)</grade>
        </grades>
        <specializations>
            <specialization code="CIVIL">Génie Civil</specialization>
            <specialization code="MECH">Génie Mécanique</specialization>
            <specialization code="ELEC">Génie Électrique</specialization>